<?xml version="1.0"?>
<!--
To change this license header, choose License Headers in Project Properties.
To change this template file, choose Tools | Templates
and open the template in the editor.

<xs:schema
    xmlns:xs="http://www.w3.org/2001/XMLSchema"
    targetNamespace="http://www.uts.edu.au/31284/wsd-diary"
    xmlns="http://www.uts.edu.au/31284/wsd-diary"
    elementFormDefault="qualified"> -->
    
<xs:schema xmlns:xs="http://www.w3.org/2001/XMLSchema">
    <xs:simpleType name="email">
        <xs:restriction base="xs:string">
            <xs:pattern value="\w+([-+.^_]\w+)*@\w+([-.]\w+)*\.\w+([-.]\w+)*"/>
        </xs:restriction>
    </xs:simpleType>
    
    <xs:simpleType name="name">
        <xs:restriction base="xs:string">
        </xs:restriction>
    </xs:simpleType>
    

    
    <xs:element name="users">
        <xs:complexType>
            <xs:sequence>
                <xs:element name="user" maxOccurs="unbounded">
                    <xs:complexType>
                        <xs:sequence>
                            <xs:element name="email" type="email"/>
                            <xs:element name="name" type="name"/>
                            <xs:element name="password" type="xs:string"/>
                            <xs:element name="DOB" type="xs:date"/>
                        </xs:sequence>
                    </xs:complexType>
                </xs:element>
            </xs:sequence>
        </xs:complexType>
    </xs:element>
</xs:schema>
